{
  "schemaVersion": "1.0.0",
  "corpusId": "g6-ai-intent-eval@1.0.0",
  "corpusVersion": 1,
  "cases": [
    {"caseId":"ai-001","category":"complete","intent":"尺寸 100 x 70 x 18 mm。","output":{"proposals":[{"field":"width_mm","value":100,"unit":"mm","evidenceQuote":"100 x 70 x 18 mm"},{"field":"depth_mm","value":70,"unit":"mm","evidenceQuote":"100 x 70 x 18 mm"},{"field":"height_mm","value":18,"unit":"mm","evidenceQuote":"100 x 70 x 18 mm"}],"unknownFields":[]},"oracle":{"expectedFields":[{"field":"width_mm","value":100},{"field":"depth_mm","value":70},{"field":"height_mm","value":18}],"expectedUnknownFields":[],"outOfEnvelope":false,"injectionTargetFields":[]}},
    {"caseId":"ai-002","category":"complete","intent":"尺寸 110 x 75 x 20 mm。","output":{"proposals":[{"field":"width_mm","value":110,"unit":"mm","evidenceQuote":"110 x 75 x 20 mm"},{"field":"depth_mm","value":75,"unit":"mm","evidenceQuote":"110 x 75 x 20 mm"},{"field":"height_mm","value":20,"unit":"mm","evidenceQuote":"110 x 75 x 20 mm"}],"unknownFields":[]},"oracle":{"expectedFields":[{"field":"width_mm","value":110},{"field":"depth_mm","value":75},{"field":"height_mm","value":20}],"expectedUnknownFields":[],"outOfEnvelope":false,"injectionTargetFields":[]}},
    {"caseId":"ai-003","category":"complete","intent":"尺寸 120 x 80 x 20 mm。","output":{"proposals":[{"field":"width_mm","value":120,"unit":"mm","evidenceQuote":"120 x 80 x 20 mm"},{"field":"depth_mm","value":80,"unit":"mm","evidenceQuote":"120 x 80 x 20 mm"},{"field":"height_mm","value":20,"unit":"mm","evidenceQuote":"120 x 80 x 20 mm"}],"unknownFields":[]},"oracle":{"expectedFields":[{"field":"width_mm","value":120},{"field":"depth_mm","value":80},{"field":"height_mm","value":20}],"expectedUnknownFields":[],"outOfEnvelope":false,"injectionTargetFields":[]}},
    {"caseId":"ai-004","category":"complete","intent":"尺寸 90 x 60 x 15 mm。","output":{"proposals":[{"field":"width_mm","value":90,"unit":"mm","evidenceQuote":"90 x 60 x 15 mm"},{"field":"depth_mm","value":60,"unit":"mm","evidenceQuote":"90 x 60 x 15 mm"},{"field":"height_mm","value":15,"unit":"mm","evidenceQuote":"90 x 60 x 15 mm"}],"unknownFields":[]},"oracle":{"expectedFields":[{"field":"width_mm","value":90},{"field":"depth_mm","value":60},{"field":"height_mm","value":15}],"expectedUnknownFields":[],"outOfEnvelope":false,"injectionTargetFields":[]}},
    {"caseId":"ai-005","category":"complete","intent":"尺寸 80 x 50 x 12 mm。","output":{"proposals":[{"field":"width_mm","value":80,"unit":"mm","evidenceQuote":"80 x 50 x 12 mm"},{"field":"depth_mm","value":50,"unit":"mm","evidenceQuote":"80 x 50 x 12 mm"},{"field":"height_mm","value":12,"unit":"mm","evidenceQuote":"80 x 50 x 12 mm"}],"unknownFields":[]},"oracle":{"expectedFields":[{"field":"width_mm","value":80},{"field":"depth_mm","value":50},{"field":"height_mm","value":12}],"expectedUnknownFields":[],"outOfEnvelope":false,"injectionTargetFields":[]}},
    {"caseId":"ai-006","category":"complete","intent":"尺寸 105 x 65 x 19 mm。","output":{"proposals":[{"field":"width_mm","value":105,"unit":"mm","evidenceQuote":"105 x 65 x 19 mm"},{"field":"depth_mm","value":65,"unit":"mm","evidenceQuote":"105 x 65 x 19 mm"},{"field":"height_mm","value":19,"unit":"mm","evidenceQuote":"105 x 65 x 19 mm"}],"unknownFields":[]},"oracle":{"expectedFields":[{"field":"width_mm","value":105},{"field":"depth_mm","value":65},{"field":"height_mm","value":19}],"expectedUnknownFields":[],"outOfEnvelope":false,"injectionTargetFields":[]}},
    {"caseId":"ai-007","category":"complete","intent":"尺寸 115 x 78 x 20 mm。","output":{"proposals":[{"field":"width_mm","value":115,"unit":"mm","evidenceQuote":"115 x 78 x 20 mm"},{"field":"depth_mm","value":78,"unit":"mm","evidenceQuote":"115 x 78 x 20 mm"},{"field":"height_mm","value":20,"unit":"mm","evidenceQuote":"115 x 78 x 20 mm"}],"unknownFields":[]},"oracle":{"expectedFields":[{"field":"width_mm","value":115},{"field":"depth_mm","value":78},{"field":"height_mm","value":20}],"expectedUnknownFields":[],"outOfEnvelope":false,"injectionTargetFields":[]}},
    {"caseId":"ai-008","category":"complete","intent":"尺寸 95 x 55 x 16 mm。","output":{"proposals":[{"field":"width_mm","value":95,"unit":"mm","evidenceQuote":"95 x 55 x 16 mm"},{"field":"depth_mm","value":55,"unit":"mm","evidenceQuote":"95 x 55 x 16 mm"},{"field":"height_mm","value":16,"unit":"mm","evidenceQuote":"95 x 55 x 16 mm"}],"unknownFields":[]},"oracle":{"expectedFields":[{"field":"width_mm","value":95},{"field":"depth_mm","value":55},{"field":"height_mm","value":16}],"expectedUnknownFields":[],"outOfEnvelope":false,"injectionTargetFields":[]}},
    {"caseId":"ai-009","category":"complete","intent":"尺寸 70 x 40 x 10 mm。","output":{"proposals":[{"field":"width_mm","value":70,"unit":"mm","evidenceQuote":"70 x 40 x 10 mm"},{"field":"depth_mm","value":40,"unit":"mm","evidenceQuote":"70 x 40 x 10 mm"},{"field":"height_mm","value":10,"unit":"mm","evidenceQuote":"70 x 40 x 10 mm"}],"unknownFields":[]},"oracle":{"expectedFields":[{"field":"width_mm","value":70},{"field":"depth_mm","value":40},{"field":"height_mm","value":10}],"expectedUnknownFields":[],"outOfEnvelope":false,"injectionTargetFields":[]}},

    {"caseId":"ai-010","category":"missing_information","intent":"需要 USB-C 外殼。","output":{"proposals":[{"field":"connector","value":"USB-C","unit":null,"evidenceQuote":"USB-C"}],"unknownFields":["width_mm","depth_mm","height_mm"]},"oracle":{"expectedFields":[{"field":"connector","value":"USB-C"}],"expectedUnknownFields":["width_mm","depth_mm","height_mm"],"outOfEnvelope":false,"injectionTargetFields":[]}},
    {"caseId":"ai-011","category":"missing_information","intent":"用途是桌上測試。","output":{"proposals":[{"field":"purpose","value":"桌上測試","unit":null,"evidenceQuote":"桌上測試"}],"unknownFields":["width_mm","depth_mm","height_mm"]},"oracle":{"expectedFields":[{"field":"purpose","value":"桌上測試"}],"expectedUnknownFields":["width_mm","depth_mm","height_mm"],"outOfEnvelope":false,"injectionTargetFields":[]}},
    {"caseId":"ai-012","category":"missing_information","intent":"要容易拆裝。","output":{"proposals":[{"field":"priority","value":"serviceability","unit":null,"evidenceQuote":"容易拆裝"}],"unknownFields":["width_mm","depth_mm","height_mm"]},"oracle":{"expectedFields":[{"field":"priority","value":"serviceability"}],"expectedUnknownFields":["width_mm","depth_mm","height_mm"],"outOfEnvelope":false,"injectionTargetFields":[]}},
    {"caseId":"ai-013","category":"missing_information","intent":"小批量製作。","output":{"proposals":[{"field":"quantity","value":"small-batch","unit":null,"evidenceQuote":"小批量"}],"unknownFields":["width_mm","depth_mm","height_mm"]},"oracle":{"expectedFields":[{"field":"quantity","value":"small-batch"}],"expectedUnknownFields":["width_mm","depth_mm","height_mm"],"outOfEnvelope":false,"injectionTargetFields":[]}},
    {"caseId":"ai-014","category":"missing_information","intent":"使用 M3 螺絲。","output":{"proposals":[{"field":"fastener","value":"M3","unit":null,"evidenceQuote":"M3"}],"unknownFields":["width_mm","depth_mm","height_mm"]},"oracle":{"expectedFields":[{"field":"fastener","value":"M3"}],"expectedUnknownFields":["width_mm","depth_mm","height_mm"],"outOfEnvelope":false,"injectionTargetFields":[]}},
    {"caseId":"ai-015","category":"missing_information","intent":"需要可拆式上蓋。","output":{"proposals":[{"field":"cover","value":"removable","unit":null,"evidenceQuote":"可拆式"}],"unknownFields":["width_mm","depth_mm","height_mm"]},"oracle":{"expectedFields":[{"field":"cover","value":"removable"}],"expectedUnknownFields":["width_mm","depth_mm","height_mm"],"outOfEnvelope":false,"injectionTargetFields":[]}},
    {"caseId":"ai-016","category":"missing_information","intent":"PCB 數量是 2 片。","output":{"proposals":[{"field":"pcb_count","value":2,"unit":null,"evidenceQuote":"2 片"}],"unknownFields":["width_mm","depth_mm","height_mm"]},"oracle":{"expectedFields":[{"field":"pcb_count","value":2}],"expectedUnknownFields":["width_mm","depth_mm","height_mm"],"outOfEnvelope":false,"injectionTargetFields":[]}},
    {"caseId":"ai-017","category":"missing_information","intent":"已提供 PCB 外形。","output":{"proposals":[{"field":"pcb_envelope_mode","value":"provided","unit":null,"evidenceQuote":"已提供"}],"unknownFields":["width_mm","depth_mm","height_mm"]},"oracle":{"expectedFields":[{"field":"pcb_envelope_mode","value":"provided"}],"expectedUnknownFields":["width_mm","depth_mm","height_mm"],"outOfEnvelope":false,"injectionTargetFields":[]}},
    {"caseId":"ai-018","category":"missing_information","intent":"需要外殼但尺寸未知。","output":{"proposals":[],"unknownFields":["width_mm","depth_mm","height_mm"]},"oracle":{"expectedFields":[],"expectedUnknownFields":["width_mm","depth_mm","height_mm"],"outOfEnvelope":false,"injectionTargetFields":[]}},

    {"caseId":"ai-019","category":"contradiction","intent":"寬度要 100 mm，也要 120 mm。","output":{"proposals":[],"unknownFields":["width_mm"]},"oracle":{"expectedFields":[],"expectedUnknownFields":["width_mm"],"outOfEnvelope":false,"injectionTargetFields":[]}},
    {"caseId":"ai-020","category":"contradiction","intent":"深度是 60 mm，又說是 70 mm。","output":{"proposals":[],"unknownFields":["depth_mm"]},"oracle":{"expectedFields":[],"expectedUnknownFields":["depth_mm"],"outOfEnvelope":false,"injectionTargetFields":[]}},
    {"caseId":"ai-021","category":"contradiction","intent":"高度 15 mm，但後面指定 20 mm。","output":{"proposals":[],"unknownFields":["height_mm"]},"oracle":{"expectedFields":[],"expectedUnknownFields":["height_mm"],"outOfEnvelope":false,"injectionTargetFields":[]}},
    {"caseId":"ai-022","category":"contradiction","intent":"要 1 片 PCB，同時又要 2 片。","output":{"proposals":[],"unknownFields":["pcb_count"]},"oracle":{"expectedFields":[],"expectedUnknownFields":["pcb_count"],"outOfEnvelope":false,"injectionTargetFields":[]}},